{
  "request_id": "example-demo-day1",
  "action": "infer",
  "stage": "stage2",
  "inputs": {
    "tmin": "daymet/data/Daymet_ERA5_tmin_dy_1990_0p25deg.nc",
    "tmax": "daymet/data/Daymet_ERA5_tmax_dy_1990_0p25deg.nc",
    "prcp": "daymet/data/Daymet_ERA5_prcp_dy_1990_0p25deg.nc"
  },
  "output": {
    "path": "artifacts/demo/day1.nc",
    "format": "netcdf"
  },
  "start_date": "1990-01-01",
  "start_index": 0,
  "end_index": 1,
  "enforce_temperature_order": true
}
